{
  "schemaVersion": 3,
  "adapterId": "cursor",
  "runtimeFamily": "cursor",
  "enabled": false,
  "supportLevel": "disabled",
  "roots": {
    "config": {
      "default": null,
      "environmentVariable": null,
      "requiresExplicit": true
    }
  },
  "discoveryPrecedence": [],
  "artifactMappings": [],
  "router": {
    "root": "config",
    "path": "AGENTS.md",
    "family": "cursor",
    "native": false
  },
  "state": {
    "root": "config",
    "path": ".wsr-active.json"
  },
  "capabilities": {
    "nativeInstructions": false,
    "nativeSlashWorkflows": false,
    "nativeProgressiveSkills": false,
    "restartAfterRouterChange": true,
    "goalSupport": "unsupported",
    "goalEntrypoint": "none",
    "subagentDispatch": false,
    "receiptContract": "goal-task-v1",
    "maxParallelTasks": 1
  },
  "legacyRoots": [],
  "unsupportedFeatures": [
    "not-release-gated"
  ]
}
